
SQL*Plus: Release 11.2.0.2.0 Production on Thu Apr 30 11:07:59 2026

Copyright (c) 1982, 2014, Oracle.  All rights reserved.

SQL> connect / as sysdba;
Connected.
SQL> create user QT233 identified by qt233;

User created.

SQL> connect qt233
Enter password:
ERROR:
ORA-01045: user QT233 lacks CREATE SESSION privilege; logon denied


Warning: You are no longer connected to ORACLE.
SQL> connect qt233
Enter password:
ERROR:
ORA-01017: invalid username/password; logon denied


SQL> connect qt233
Enter password:
ERROR:
ORA-01045: user QT233 lacks CREATE SESSION privilege; logon denied


SQL> connect / as sysdba;
Connected.
SQL> grant all privileges to qt233;

Grant succeeded.

SQL> connect sysdba;
Enter password:
ERROR:
ORA-01017: invalid username/password; logon denied


Warning: You are no longer connected to ORACLE.
SQL> connect sysdba;
Enter password:
ERROR:
ORA-01017: invalid username/password; logon denied


SQL> connect qt233;
Enter password:
Connected.
SQL> revoke all privileges from qt233;

Revoke succeeded.

SQL> connect qt233;
Enter password:
ERROR:
ORA-01045: user QT233 lacks CREATE SESSION privilege; logon denied


Warning: You are no longer connected to ORACLE.
SQL> grant all privileges to qt233;
SP2-0640: Not connected
SQL> connect / as sysdba;
Connected.
SQL> grant all privileges to qt233;

Grant succeeded.

SQL> connect qt233;
Enter password:
Connected.
SQL>
=======================

SQL*Plus: Release 11.2.0.2.0 Production on Fri May 1 10:39:47 2026

Copyright (c) 1982, 2014, Oracle.  All rights reserved.

SQL> select * from tab;
SP2-0640: Not connected
SQL> connect qt233
Enter password:
Connected.
SQL> select * from tab;

no rows selected

SQL> create table Student(htno number(2),sname varchar2(10),cource varchar2(10));

Table created.

SQL> create table Student1(htno number,sname varchar2(10),cource varchar2(10));

Table created.

SQL> create table Student2(htno number,sname varchar2(10)cource varchar2(10));
create table Student2(htno number,sname varchar2(10)cource varchar2(10))
                                                    *
ERROR at line 1:
ORA-00907: missing right parenthesis


SQL> select * from tab;

TNAME                          TABTYPE  CLUSTERID
------------------------------ ------- ----------
STUDENT                        TABLE
STUDENT1                       TABLE

SQL> drop student1;
drop student1
     *
ERROR at line 1:
ORA-00950: invalid DROP option


SQL> drop table student1;

Table dropped.

SQL> select * from tab;

TNAME                          TABTYPE  CLUSTERID
------------------------------ ------- ----------
STUDENT                        TABLE

SQL> desc student;
 Name                                      Null?    Type
 ----------------------------------------- -------- ----------------------------
 HTNO                                               NUMBER(2)
 SNAME                                              VARCHAR2(10)
 COURCE                                             VARCHAR2(10)

SQL> desc stu;
ERROR:
ORA-04043: object stu does not exist


SQL> alter table student add(fee number(5));

Table altered.

SQL> desc stu;
ERROR:
ORA-04043: object stu does not exist


SQL> desc student;
 Name                                      Null?    Type
 ----------------------------------------- -------- ----------------------------
 HTNO                                               NUMBER(2)
 SNAME                                              VARCHAR2(10)
 COURCE                                             VARCHAR2(10)
 FEE                                                NUMBER(5)

SQL> alter table student modify(htno number(3));

Table altered.

SQL> alter table student modify(cource char(10));

Table altered.

SQL> desc student;
 Name                                      Null?    Type
 ----------------------------------------- -------- ----------------------------
 HTNO                                               NUMBER(3)
 SNAME                                              VARCHAR2(10)
 COURCE                                             CHAR(10)
 FEE                                                NUMBER(5)

SQL> alter table student modify(rno number(3));
alter table student modify(rno number(3))
                           *
ERROR at line 1:
ORA-00904: "RNO": invalid identifier


SQL> alter table student rename column htno to rno;

Table altered.

SQL> desc student;
 Name                                      Null?    Type
 ----------------------------------------- -------- ----------------------------
 RNO                                                NUMBER(3)
 SNAME                                              VARCHAR2(10)
 COURCE                                             CHAR(10)
 FEE                                                NUMBER(5)

SQL> alter table student drop column fee;

Table altered.

SQL> desc student;
 Name                                      Null?    Type
 ----------------------------------------- -------- ----------------------------
 RNO                                                NUMBER(3)
 SNAME                                              VARCHAR2(10)
 COURCE                                             CHAR(10)

SQL> alter table student add(fee number(5));

Table altered.

SQL> desc student;
 Name                                      Null?    Type
 ----------------------------------------- -------- ----------------------------
 RNO                                                NUMBER(3)
 SNAME                                              VARCHAR2(10)
 COURCE                                             CHAR(10)
 FEE                                                NUMBER(5)

SQL> rename student to stu;

Table renamed.

SQL> desc student;
ERROR:
ORA-04043: object student does not exist


SQL> desc stu;
 Name                                      Null?    Type
 ----------------------------------------- -------- ----------------------------
 RNO                                                NUMBER(3)
 SNAME                                              VARCHAR2(10)
 COURCE                                             CHAR(10)
 FEE                                                NUMBER(5)

SQL> insert into student values(101,'Krishna','Testing',5000);
insert into student values(101,'Krishna','Testing',5000)
            *
ERROR at line 1:
ORA-00942: table or view does not exist


SQL> insert into stu values(101,'Krishna','Testing',5000);

1 row created.

SQL> desc stu;
 Name                                      Null?    Type
 ----------------------------------------- -------- ----------------------------
 RNO                                                NUMBER(3)
 SNAME                                              VARCHAR2(10)
 COURCE                                             CHAR(10)
 FEE                                                NUMBER(5)

SQL> select * from stu;

       RNO SNAME      COURCE            FEE
---------- ---------- ---------- ----------
       101 Krishna    Testing          5000

SQL> insert into stu values(102,'Madhu','API',3000);

1 row created.

SQL> select rno from stu;

       RNO
----------
       101
       102

SQL> select rno from stu where rno=102;

       RNO
----------
       102

SQL> insert into stu values(102,'Madhu','API');
insert into stu values(102,'Madhu','API')
            *
ERROR at line 1:
ORA-00947: not enough values


SQL> insert into stu(rno,sname,cource) values(103,'Ramesh','Java');

1 row created.

SQL> select * from stu;

       RNO SNAME      COURCE            FEE
---------- ---------- ---------- ----------
       101 Krishna    Testing          5000
       102 Madhu      API              3000
       103 Ramesh     Java

SQL> insert into stu values(&rno,&sname,&cource,&fee);
Enter value for rno: 104
Enter value for sname: 'dgef'
Enter value for cource: 'gefeg'
Enter value for fee: 6000
old   1: insert into stu values(&rno,&sname,&cource,&fee)
new   1: insert into stu values(104,'dgef','gefeg',6000)

1 row created.

SQL> /
Enter value for rno: 105
Enter value for sname: 'dfgdf'
Enter value for cource: 'vddfd
Enter value for fee: 8000
old   1: insert into stu values(&rno,&sname,&cource,&fee)
new   1: insert into stu values(105,'dfgdf','vddfd,8000)
ERROR:
ORA-01756: quoted string not properly terminated


SQL> /
Enter value for rno: 105
Enter value for sname: 'dfgdf'
Enter value for cource: 'vddfd'
Enter value for fee: 8000
old   1: insert into stu values(&rno,&sname,&cource,&fee)
new   1: insert into stu values(105,'dfgdf','vddfd',8000)

1 row created.

SQL> select * from stu;

       RNO SNAME      COURCE            FEE
---------- ---------- ---------- ----------
       101 Krishna    Testing          5000
       102 Madhu      API              3000
       103 Ramesh     Java
       104 dgef       gefeg            6000
       105 dfgdf      vddfd            8000

SQL> insert into stu values(&&rno,&&sname,&&cource,&&fee);
Enter value for rno: 106
Enter value for sname: 'Suman'
Enter value for cource: 'Python'
Enter value for fee: 7000
old   1: insert into stu values(&&rno,&&sname,&&cource,&&fee)
new   1: insert into stu values(106,'Suman','Python',7000)

1 row created.

SQL> //
old   1: insert into stu values(&&rno,&&sname,&&cource,&&fee)
new   1: insert into stu values(106,'Suman','Python',7000)

1 row created.

SQL> //
old   1: insert into stu values(&&rno,&&sname,&&cource,&&fee)
new   1: insert into stu values(106,'Suman','Python',7000)

1 row created.

SQL> //
old   1: insert into stu values(&&rno,&&sname,&&cource,&&fee)
new   1: insert into stu values(106,'Suman','Python',7000)

1 row created.

SQL> //
old   1: insert into stu values(&&rno,&&sname,&&cource,&&fee)
new   1: insert into stu values(106,'Suman','Python',7000)

1 row created.

SQL> //
old   1: insert into stu values(&&rno,&&sname,&&cource,&&fee)
new   1: insert into stu values(106,'Suman','Python',7000)

1 row created.

SQL> select * from stu;

       RNO SNAME      COURCE            FEE
---------- ---------- ---------- ----------
       101 Krishna    Testing          5000
       102 Madhu      API              3000
       103 Ramesh     Java
       104 dgef       gefeg            6000
       105 dfgdf      vddfd            8000
       106 Suman      Python           7000
       106 Suman      Python           7000
       106 Suman      Python           7000
       106 Suman      Python           7000
       106 Suman      Python           7000
       106 Suman      Python           7000

11 rows selected.

SQL> commit;

Commit complete.

SQL> update stu set fee=4000;

11 rows updated.

SQL> select * from stu;

       RNO SNAME      COURCE            FEE
---------- ---------- ---------- ----------
       101 Krishna    Testing          4000
       102 Madhu      API              4000
       103 Ramesh     Java             4000
       104 dgef       gefeg            4000
       105 dfgdf      vddfd            4000
       106 Suman      Python           4000
       106 Suman      Python           4000
       106 Suman      Python           4000
       106 Suman      Python           4000
       106 Suman      Python           4000
       106 Suman      Python           4000

11 rows selected.

SQL> rollback;

Rollback complete.

SQL> select * from stu;

       RNO SNAME      COURCE            FEE
---------- ---------- ---------- ----------
       101 Krishna    Testing          5000
       102 Madhu      API              3000
       103 Ramesh     Java
       104 dgef       gefeg            6000
       105 dfgdf      vddfd            8000
       106 Suman      Python           7000
       106 Suman      Python           7000
       106 Suman      Python           7000
       106 Suman      Python           7000
       106 Suman      Python           7000
       106 Suman      Python           7000

11 rows selected.

SQL> update stu set fee=4000 where rno=103;

1 row updated.

SQL> select * from stu;

       RNO SNAME      COURCE            FEE
---------- ---------- ---------- ----------
       101 Krishna    Testing          5000
       102 Madhu      API              3000
       103 Ramesh     Java             4000
       104 dgef       gefeg            6000
       105 dfgdf      vddfd            8000
       106 Suman      Python           7000
       106 Suman      Python           7000
       106 Suman      Python           7000
       106 Suman      Python           7000
       106 Suman      Python           7000
       106 Suman      Python           7000

11 rows selected.

SQL> update stu set fee=4000 where rno=109;

0 rows updated.

SQL> update stu set fee=9000 where rno=102 && cource='API;
old   1: update stu set fee=9000 where rno=102 && cource='API
new   1: update stu set fee=9000 where rno=102 'Python'='API
ERROR:
ORA-01756: quoted string not properly terminated


SQL> update stu set fee=9000 where rno=102 && cource='API';
old   1: update stu set fee=9000 where rno=102 && cource='API'
new   1: update stu set fee=9000 where rno=102 'Python'='API'
update stu set fee=9000 where rno=102 'Python'='API'
                                      *
ERROR at line 1:
ORA-00933: SQL command not properly ended


SQL> update stu set fee=9000 where rno=102 & cource='API';
old   1: update stu set fee=9000 where rno=102 & cource='API'
new   1: update stu set fee=9000 where rno=102 'Python'='API'
update stu set fee=9000 where rno=102 'Python'='API'
                                      *
ERROR at line 1:
ORA-00933: SQL command not properly ended


SQL> update stu set fee=9000 where rno=102 and cource='API';

1 row updated.

SQL> select * from stu;

       RNO SNAME      COURCE            FEE
---------- ---------- ---------- ----------
       101 Krishna    Testing          5000
       102 Madhu      API              9000
       103 Ramesh     Java             4000
       104 dgef       gefeg            6000
       105 dfgdf      vddfd            8000
       106 Suman      Python           7000
       106 Suman      Python           7000
       106 Suman      Python           7000
       106 Suman      Python           7000
       106 Suman      Python           7000
       106 Suman      Python           7000

11 rows selected.

SQL> update stu set fee=9000 where rno=109 and cource='API';

0 rows updated.

SQL>
===============

SQL*Plus: Release 11.2.0.2.0 Production on Mon May 4 10:53:15 2026

Copyright (c) 1982, 2014, Oracle.  All rights reserved.

SQL> connect qt233
Enter password:
Connected.
SQL> select * from tab;

TNAME                          TABTYPE  CLUSTERID
------------------------------ ------- ----------
STU                            TABLE

SQL> desc stu;
 Name                                      Null?    Type
 ----------------------------------------- -------- ----------------------------
 RNO                                                NUMBER(3)
 SNAME                                              VARCHAR2(10)
 COURCE                                             CHAR(10)
 FEE                                                NUMBER(5)

SQL> select * from stu;

       RNO SNAME      COURCE            FEE
---------- ---------- ---------- ----------
       101 Krishna    Testing          5000
       102 Madhu      API              9000
       103 Ramesh     Java             4000
       104 dgef       gefeg            6000
       105 dfgdf      vddfd            8000
       106 Suman      Python           7000
       106 Suman      Python           7000
       106 Suman      Python           7000
       106 Suman      Python           7000
       106 Suman      Python           7000
       106 Suman      Python           7000

11 rows selected.

SQL> create table student(sid number(5),sname char(20),gender char(1),percentage number(5,2),dob date);

Table created.

SQL> alter table student modify(sname varchar2(20));

Table altered.

SQL> desc student;
 Name                                      Null?    Type
 ----------------------------------------- -------- ----------------------------
 SID                                                NUMBER(5)
 SNAME                                              VARCHAR2(20)
 GENDER                                             CHAR(1)
 PERCENTAGE                                         NUMBER(5,2)
 DOB                                                DATE

SQL> insert into student values(101,'Krishna','M',199.99,'10/jan/99');

1 row created.

SQL> select * from student;

       SID SNAME                G PERCENTAGE DOB
---------- -------------------- - ---------- ---------
       101 Krishna              M     199.99 10-JAN-99

SQL> insert into student values(101,'Krishna','Male',199.99,'10/jan/99');
insert into student values(101,'Krishna','Male',199.99,'10/jan/99')
                                         *
ERROR at line 1:
ORA-12899: value too large for column "QT233"."STUDENT"."GENDER" (actual: 4,
maximum: 1)


SQL> insert into student values(101,'Krishna','M',199.999,'10/jan/99');

1 row created.

SQL> insert into student values(101,'Krishna','M',199.9999,'10/jan/99');

1 row created.

SQL> insert into student values(101,'Krishna','M',1999.9999,'10/jan/99');
insert into student values(101,'Krishna','M',1999.9999,'10/jan/99')
                                             *
ERROR at line 1:
ORA-01438: value larger than specified precision allowed for this column


SQL> insert into student values(101,'Krishna','M',199.99,'10/january/99');

1 row created.

SQL> select * from student;

       SID SNAME                G PERCENTAGE DOB
---------- -------------------- - ---------- ---------
       101 Krishna              M     199.99 10-JAN-99
       101 Krishna              M        200 10-JAN-99
       101 Krishna              M        200 10-JAN-99
       101 Krishna              M     199.99 10-JAN-99

SQL> update table student set sname='Ramesh' where sid=101;
update table student set sname='Ramesh' where sid=101
       *
ERROR at line 1:
ORA-00903: invalid table name


SQL> update  student set sname='Ramesh' where sid=101;

4 rows updated.

SQL> select * from student;

       SID SNAME                G PERCENTAGE DOB
---------- -------------------- - ---------- ---------
       101 Ramesh               M     199.99 10-JAN-99
       101 Ramesh               M        200 10-JAN-99
       101 Ramesh               M        200 10-JAN-99
       101 Ramesh               M     199.99 10-JAN-99

SQL> update  student set sname='Krishna' where percentage=200;

2 rows updated.

SQL> select * from student;

       SID SNAME                G PERCENTAGE DOB
---------- -------------------- - ---------- ---------
       101 Ramesh               M     199.99 10-JAN-99
       101 Krishna              M        200 10-JAN-99
       101 Krishna              M        200 10-JAN-99
       101 Ramesh               M     199.99 10-JAN-99

SQL> select sid,sname from student;

       SID SNAME
---------- --------------------
       101 Ramesh
       101 Krishna
       101 Krishna
       101 Ramesh

SQL> select sid,sname from student where sid=101;

       SID SNAME
---------- --------------------
       101 Ramesh
       101 Krishna
       101 Krishna
       101 Ramesh

SQL> select sid,sname from student where sname='Ramesh';

       SID SNAME
---------- --------------------
       101 Ramesh
       101 Ramesh

SQL> select sid,sname from student where sname='Suresh';

no rows selected

SQL> select * from student where percentage !=200;

       SID SNAME                G PERCENTAGE DOB
---------- -------------------- - ---------- ---------
       101 Ramesh               M     199.99 10-JAN-99
       101 Ramesh               M     199.99 10-JAN-99

SQL> select * from student where percentage =200;

       SID SNAME                G PERCENTAGE DOB
---------- -------------------- - ---------- ---------
       101 Krishna              M        200 10-JAN-99
       101 Krishna              M        200 10-JAN-99

SQL> commit;

Commit complete.

SQL> delete student;

4 rows deleted.

SQL> select * from student;

no rows selected

SQL> rollback;

Rollback complete.

SQL> select * from student;

       SID SNAME                G PERCENTAGE DOB
---------- -------------------- - ---------- ---------
       101 Ramesh               M     199.99 10-JAN-99
       101 Krishna              M        200 10-JAN-99
       101 Krishna              M        200 10-JAN-99
       101 Ramesh               M     199.99 10-JAN-99

SQL> delate student where percenatge=199.99;
SP2-0734: unknown command beginning "delate stu..." - rest of line ignored.
SQL> delete student where percenatge=199.99;
delete student where percenatge=199.99
                     *
ERROR at line 1:
ORA-00904: "PERCENATGE": invalid identifier


SQL> delete student where percentage=199.99;

2 rows deleted.

SQL> select * from student;

       SID SNAME                G PERCENTAGE DOB
---------- -------------------- - ---------- ---------
       101 Krishna              M        200 10-JAN-99
       101 Krishna              M        200 10-JAN-99

SQL> commit;

Commit complete.

SQL> create table s1 select * from student;
create table s1 select * from student
                *
ERROR at line 1:
ORA-00922: missing or invalid option


SQL> create table s1 as select * from student;

Table created.

SQL> create table s2 as select * from student;

Table created.

SQL> create table s3 as select * from student;

Table created.

SQL> select * from tab;

TNAME                          TABTYPE  CLUSTERID
------------------------------ ------- ----------
S1                             TABLE
S2                             TABLE
S3                             TABLE
STU                            TABLE
STUDENT                        TABLE

SQL> select * from s1;

       SID SNAME                G PERCENTAGE DOB
---------- -------------------- - ---------- ---------
       101 Krishna              M        200 10-JAN-99
       101 Krishna              M        200 10-JAN-99

SQL> select * from s2;

       SID SNAME                G PERCENTAGE DOB
---------- -------------------- - ---------- ---------
       101 Krishna              M        200 10-JAN-99
       101 Krishna              M        200 10-JAN-99

SQL> select * from s3;

       SID SNAME                G PERCENTAGE DOB
---------- -------------------- - ---------- ---------
       101 Krishna              M        200 10-JAN-99
       101 Krishna              M        200 10-JAN-99

SQL> commit;

Commit complete.

SQL> drop s3;
drop s3
     *
ERROR at line 1:
ORA-00950: invalid DROP option


SQL> drop table s3;

Table dropped.

SQL> select * from s3;
select * from s3
              *
ERROR at line 1:
ORA-00942: table or view does not exist


SQL> desc s3;
ERROR:
ORA-04043: object s3 does not exist


SQL> rollback;

Rollback complete.

SQL> desc s3;
ERROR:
ORA-04043: object s3 does not exist


SQL> select * from s3;
select * from s3
              *
ERROR at line 1:
ORA-00942: table or view does not exist


SQL> truncate s2;
truncate s2
          *
ERROR at line 1:
ORA-03290: Invalid truncate command - missing CLUSTER or TABLE keyword


SQL> truncate table s2;

Table truncated.

SQL> select * from s2;

no rows selected

SQL> desc s2;
 Name                                      Null?    Type
 ----------------------------------------- -------- ----------------------------
 SID                                                NUMBER(5)
 SNAME                                              VARCHAR2(20)
 GENDER                                             CHAR(1)
 PERCENTAGE                                         NUMBER(5,2)
 DOB                                                DATE

SQL> rollback;

Rollback complete.

SQL> desc s2;
 Name                                      Null?    Type
 ----------------------------------------- -------- ----------------------------
 SID                                                NUMBER(5)
 SNAME                                              VARCHAR2(20)
 GENDER                                             CHAR(1)
 PERCENTAGE                                         NUMBER(5,2)
 DOB                                                DATE

SQL> select * from s2;

no rows selected

SQL> truncate table s2 where sid=101;
truncate table s2 where sid=101
                  *
ERROR at line 1:
ORA-03291: Invalid truncate option - missing STORAGE keyword


SQL> delete s1;

2 rows deleted.

SQL> select * from s1;

no rows selected

SQL> rollback;

Rollback complete.

SQL> select * from s1;

       SID SNAME                G PERCENTAGE DOB
---------- -------------------- - ---------- ---------
       101 Krishna              M        200 10-JAN-99
       101 Krishna              M        200 10-JAN-99

SQL> delete s1 where sid=101;

2 rows deleted.

SQL> rollback;

Rollback complete.

SQL> select * from s1;

       SID SNAME                G PERCENTAGE DOB
---------- -------------------- - ---------- ---------
       101 Krishna              M        200 10-JAN-99
       101 Krishna              M        200 10-JAN-99

SQL>